{
  "slug": "cairo-nile-cruise-8-day",
  "title": "Egyptian Pharaohs – Cairo & Nile Cruise – 8 Days",
  "itinerary_type": "long",
  "country_slug": "egypt",
  "destination_slug": "luxor",
  "operator_slug": "pharaoh-quest-travel",
  "summary": "Complete Egyptian journey: Pyramids, Egyptian Museum, Nile cruise from Luxor to Aswan, Abu Simbel.",
  "description": "Uncover ancient secrets with expert guides, enjoy 5-star cruise amenities, and marvel at temples.",
  "duration_days": 8,
  "nights": 7,
  "from_price": 1250,
  "currency": "USD",
  "price_label": "per person sharing (based on double cabin)",
  "inclusions": [
    "4 nights Cairo hotel (BB)",
    "4 nights Nile cruise (full board)",
    "Domestic flights (Cairo/Luxor and Aswan/Cairo)",
    "All entrance fees and guided tours",
    "Abu Simbel excursion by coach"
  ],
  "exclusions": ["International flights", "Visa", "Drinks", "Tips"],
  "highlights": [
    "Giza Pyramids & Sphinx",
    "Egyptian Museum treasures",
    "Karnak & Luxor Temples",
    "Valley of the Kings",
    "Edfu & Kom Ombo",
    "Abu Simbel sun temple"
  ],
  "available_months": ["Oct", "Nov", "Dec", "Jan", "Feb", "Mar"],
  "hero_image_url": "https://images.unsplash.com/photo-1539768942893-daf53e448371?w=1600",
  "max_group_size": 25,
  "min_group_size": 2,
  "verified_status": "verified",
  "review_count": 312,
  "average_rating": 4.8,
  "response_time_hours": 4,
  "cancellation_policy": "Standard – 45 days for full refund",
  "payment_policy": "25% deposit, balance 60 days before",
  "is_featured": true,
  "is_published": true,
  "days": [
    {
      "day_number": 1,
      "title": "Arrival Cairo",
      "summary": "Meet at Cairo airport, transfer to hotel. Optional evening sound & light show at Pyramids.",
      "accommodation_slug": "cairo-pyramid-view-hotel",
      "meals_included": [],
      "activities": ["Welcome meeting", "Pyramids illumination (optional)"],
      "drive_time_label": "30 min from airport"
    },
    {
      "day_number": 2,
      "title": "Cairo – Pyramids, Sphinx & Egyptian Museum",
      "summary": "Full-day tour: Giza Plateau, Great Pyramid interior (optional), and Tutankhamun treasures.",
      "accommodation_slug": "cairo-pyramid-view-hotel",
      "meals_included": ["Breakfast"],
      "activities": ["Pyramids panorama", "Solar Boat Museum", "Mummy room"],
      "drive_time_label": "1 hour total driving"
    },
    {
      "day_number": 3,
      "title": "Fly to Luxor – Embark Nile Cruise – East Bank Temples",
      "summary": "Morning flight to Luxor, board MS Memphis, visit Karnak and Luxor Temples.",
      "accommodation_slug": "ms-memphis-nile-cruise",
      "meals_included": ["Breakfast", "Lunch", "Dinner"],
      "activities": ["Karnak Great Hypostyle Hall", "Luxor Temple by night"],
      "drive_time_label": "1 hr flight + short drives"
    },
    {
      "day_number": 4,
      "title": "Luxor West Bank – Valley of the Kings, Hatshepsut Temple",
      "summary": "Cross to West Bank: Tutankhamun's tomb, Ramses VI, Deir el-Bahari, Colossi of Memnon.",
      "accommodation_slug": "ms-memphis-nile-cruise",
      "meals_included": ["Breakfast", "Lunch", "Dinner"],
      "activities": ["3 royal tombs", "Alabaster factory visit"],
      "drive_time_label": "30 min crossing"
    },
    {
      "day_number": 5,
      "title": "Sail to Edfu & Kom Ombo Temples",
      "summary": "Morning visit to Horus Temple at Edfu, afternoon Kom Ombo (crocodile god). Sail to Aswan.",
      "accommodation_slug": "ms-memphis-nile-cruise",
      "meals_included": ["Breakfast", "Lunch", "Dinner"],
      "activities": ["Horse carriage to Edfu", "Crocodile mummies museum"],
      "drive_time_label": "Cruising + short carriage"
    },
    {
      "day_number": 6,
      "title": "Aswan – High Dam, Philae Temple, Unfinished Obelisk",
      "summary": "Morning Aswan sights, afternoon optional felucca ride on the Nile.",
      "accommodation_slug": "ms-memphis-nile-cruise",
      "meals_included": ["Breakfast", "Lunch", "Dinner"],
      "activities": ["Philae Sound & Light", "Nubian village visit (optional)"],
      "drive_time_label": "1 hour total"
    },
    {
      "day_number": 7,
      "title": "Abu Simbel Excursion – Fly back to Cairo",
      "summary": "Early morning drive to Abu Simbel temples of Ramses II. Afternoon flight to Cairo.",
      "accommodation_slug": "cairo-pyramid-view-hotel",
      "meals_included": ["Breakfast", "Lunch box"],
      "activities": ["Sun alignment chambers", "Relocation story museum"],
      "drive_time_label": "3 hrs each way + 1.5 hr flight"
    },
    {
      "day_number": 8,
      "title": "Departure Cairo",
      "summary": "Breakfast at hotel, then transfer to Cairo International Airport.",
      "accommodation_slug": "cairo-pyramid-view-hotel",
      "meals_included": ["Breakfast"],
      "activities": ["Last minute souvenir shopping at Khan el-Khalili (if time)"],
      "drive_time_label": "45 min to airport"
    }
  ]
}
