{
  "slug": "maputo-national-park-5-day",
  "title": "2-Day Maputo Special Reserve Guided Tour",
  "itinerary_type": "short",
  "country_slug": "mozambique",
  "destination_slug": "maputo-national-park",
  "operator_slug": "tourhq-local-guide",
  "summary": "Bush-and-coast short trip mixing Maputo city highlights with safari time in Maputo Special Reserve.",
  "description": "A two-day itinerary from Maputo combining city sightseeing, Mukapane and Macaneta, and a dedicated wildlife day in Maputo Special Reserve.",
  "duration_days": 2,
  "nights": 1,
  "from_price": 0,
  "currency": "USD",
  "price_label": "per person",
  "inclusions": ["Professional Field Guide", "Tea/Coffee/Soft Drinks", "Breakfast", "Lunch", "Snacks", "4x4 Safari", "Entrance Fees"],
  "exclusions": ["Personal Items", "Meals not specified", "Activities not specified"],
  "highlights": ["Maputo landmarks", "Macaneta beach stop", "4x4 safari", "Maputo Special Reserve wildlife"],
  "available_months": [],
  "hero_image_url": "https://sspark.genspark.ai/cfimages?u1=V%2FhLS54yduiMp1jZuoKTncJWajcq30HecflT7kpd43WNvkok%2BNcahOSZiV0qMtNaWU3MCUVdeBrWj300yJdr8Z%2F5DhEMD31H9OAd%2FV%2Fa3ie7%2B4REgaq6NvkbUT5TLgg%3D&u2=fS4FuUtifk6Dwhzs&width=2560",
  "max_group_size": 0,
  "min_group_size": 1,
  "verified_status": "verified",
  "review_count": 0,
  "average_rating": 0.0,
  "response_time_hours": 0,
  "cancellation_policy": "80% refund for cancellations up to 2 days before the tour.",
  "payment_policy": "",
  "is_featured": false,
  "is_published": true,
  "days": [
    {
      "day_number": 1,
      "title": "Maputo city tour, Mukapane and Macaneta",
      "summary": "Visit key landmarks in Maputo, then continue to Mukapane and Macaneta for nature time and beach relaxation.",
      "accommodation_slug": "maputo-city-hotel",
      "meals_included": ["Breakfast", "Lunch", "Snacks"],
      "activities": ["City tour", "4x4 safari", "Beach stop"],
      "drive_time_label": "Full day touring"
    },
    {
      "day_number": 2,
      "title": "Maputo Special Reserve safari",
      "summary": "Drive via the Maputo-Katembe bridge into the reserve for a full wildlife and landscape day before returning to Maputo.",
      "accommodation_slug": "maputo-city-hotel",
      "meals_included": ["Breakfast", "Lunch", "Snacks"],
      "activities": ["Reserve entry", "Wildlife viewing", "4x4 safari"],
      "drive_time_label": "50 mins to reserve"
    }
  ]
}
