{
  "slug": "seychelles-island-hopper-7-day",
  "title": "Seychelles Island Hopper – 7 Days",
  "itinerary_type": "long",
  "country_slug": "seychelles",
  "destination_slug": "mahe",
  "operator_slug": "creole-island-escapes",
  "summary": "Three islands: Mahé, Praslin, and La Digue – the ultimate granitic paradise.",
  "description": "Catamaran crossings, iconic beaches, Creole cuisine, and giant tortoises.",
  "duration_days": 7,
  "nights": 6,
  "from_price": 1990,
  "currency": "USD",
  "price_label": "per person sharing (based on double occupancy)",
  "inclusions": [
    "6 nights accommodation (BB)",
    "Inter-island ferry transfers",
    "Private airport transfers",
    "La Digue bicycle rental",
    "Vallee de Mai entrance fee"
  ],
  "exclusions": ["International flights", "Dinners", "Drinks", "Optional tours (scuba)"],
  "highlights": [
    "Beau Vallon beach",
    "Morne Seychellois hike",
    "Anse Lazio (Praslin)",
    "Coco de Mer valley",
    "Anse Source d'Argent (La Digue)",
    "Giant tortoises"
  ],
  "available_months": ["Apr", "May", "Jun", "Sep", "Oct", "Nov"],
  "hero_image_url": "https://a.otcdn.com/imglib/almacen_fotos/travel_republic_1000x1000/photo_389.jpg",
  "max_group_size": 12,
  "min_group_size": 2,
  "verified_status": "verified",
  "review_count": 84,
  "average_rating": 4.9,
  "response_time_hours": 3,
  "cancellation_policy": "Flexible – 21 days for full refund",
  "payment_policy": "30% deposit, balance 45 days before",
  "is_featured": true,
  "is_published": true,
  "days": [
    {
      "day_number": 1,
      "title": "Arrival Mahé – Beau Vallon Beach",
      "summary": "Transfer to villa, afternoon at leisure on one of Seychelles' best beaches.",
      "accommodation_slug": "mahe-beach-villa",
      "meals_included": ["Breakfast"],
      "activities": ["Swimming", "Sunset walk"],
      "drive_time_label": "20 min from airport"
    },
    {
      "day_number": 2,
      "title": "Mahé Discovery – Victoria Market & Morne Seychellois",
      "summary": "Visit capital Victoria, then optional hike in the national park with panoramic views.",
      "accommodation_slug": "mahe-beach-villa",
      "meals_included": ["Breakfast"],
      "activities": ["Sir Selwyn Selwyn-Clarke Market", "Mission Lodge viewpoint"],
      "drive_time_label": "1 hour total driving"
    },
    {
      "day_number": 3,
      "title": "Ferry to Praslin – Vallée de Mai & Anse Lazio",
      "summary": "Morning catamaran to Praslin, UNESCO forest tour, afternoon at top-rated beach.",
      "accommodation_slug": "praslin-constance-lodge",
      "meals_included": ["Breakfast"],
      "activities": ["Coco de Mer palms", "Snorkeling at Anse Lazio"],
      "drive_time_label": "1 hr ferry + 30 min drive"
    },
    {
      "day_number": 4,
      "title": "Praslin – Curieuse Island & St. Pierre (optional excursion)",
      "summary": "Optional full-day boat trip to see giant tortoises and snorkel with tropical fish.",
      "accommodation_slug": "praslin-constance-lodge",
      "meals_included": ["Breakfast"],
      "activities": ["Tortoise feeding", "Barbecue lunch (optional)", "Coral gardens"],
      "drive_time_label": "30 min boat each way"
    },
    {
      "day_number": 5,
      "title": "Ferry to La Digue – Bicycle & Anse Source d'Argent",
      "summary": "Short ferry to La Digue, cycle to the world-famous granite boulder beach.",
      "accommodation_slug": "praslin-constance-lodge",
      "meals_included": ["Breakfast"],
      "activities": ["Union Estate vanilla plantation", "Eagle ray spotting"],
      "drive_time_label": "15 min ferry + cycling"
    },
    {
      "day_number": 6,
      "title": "Praslin – Relax or Anse Georgette",
      "summary": "Free day to relax or hike to secluded Anse Georgette (requires permission).",
      "accommodation_slug": "praslin-constance-lodge",
      "meals_included": ["Breakfast"],
      "activities": ["Spa treatment", "Kayaking"],
      "drive_time_label": "No transfers"
    },
    {
      "day_number": 7,
      "title": "Praslin – Mahé – Departure",
      "summary": "Morning ferry back to Mahé, transfer to international airport for flight home.",
      "accommodation_slug": "praslin-constance-lodge",
      "meals_included": ["Breakfast"],
      "activities": ["Last minute souvenir at Praslin jetty"],
      "drive_time_label": "1 hr ferry + 20 min to airport"
    }
  ]
}





