{
  "slug": "sossusvlei-express-2-day",
  "title": "2-Day Sossusvlei Express",
  "itinerary_type": "short",
  "country_slug": "namibia",
  "destination_slug": "sossusvlei",
  "operator_slug": "moafrika-tours",
  "summary": "Short desert itinerary built around Sesriem, Sossusvlei, and iconic red dunes.",
  "description": "A very compact Namibia desert route typically starting from Windhoek and focusing on the core Sossusvlei highlights over two days.",
  "duration_days": 2,
  "nights": 1,
  "from_price": 0,
  "currency": "USD",
  "price_label": "per person",
  "inclusions": ["Accommodation", "Road Transfers", "Sossusvlei visit"],
  "exclusions": [],
  "highlights": ["Namib Desert", "Sesriem area", "Sossusvlei dunes", "Deadvlei-style desert scenery"],
  "available_months": [],
  "hero_image_url": "https://sspark.genspark.ai/cfimages?u1=hb3Bgf70Fk8wdPXu0yO9kH%2FbeWcK70yJcrdYjsqVgtXQM6pqYZwnTY7MkyprBO2tOPnlW2ahHZaa6TayUEiNJEBGurQtxoxqHADaJDoX43sI4q%2FTdzsjdGAN9A7h5qx7mU93YcbJeL%2FzUPVYRYcTaw%3D%3D&u2=6Lep08au296pj7xw&width=2560",
  "max_group_size": 0,
  "min_group_size": 1,
  "verified_status": "verified",
  "review_count": 0,
  "average_rating": 0.0,
  "response_time_hours": 0,
  "cancellation_policy": "",
  "payment_policy": "",
  "is_featured": false,
  "is_published": true,
  "days": [
    {
      "day_number": 1,
      "title": "Windhoek to Sesriem",
      "summary": "Depart Windhoek and drive into the Namib Desert region, arriving near Sesriem for overnight.",
      "accommodation_slug": "sesriem-desert-lodge",
      "meals_included": [],
      "activities": ["Road transfer", "Desert arrival"],
      "drive_time_label": "320 km"
    },
    {
      "day_number": 2,
      "title": "Sossusvlei and departure",
      "summary": "Visit the dunes and desert landmarks around Sossusvlei before onward transfer or return.",
      "accommodation_slug": "sesriem-desert-lodge",
      "meals_included": [],
      "activities": ["Dune visit", "Desert photography", "Departure transfer"],
      "drive_time_label": "Flexible"
    }
  ]
}

